{
  "schema_version": 1,
  "atlas_id": "frontend-behavior-atlas",
  "generated_at": "2026-08-28T00:00:00+09:00",
  "status": "incomplete-human-review-required",
  "input_digest": "sha256:130d8df21b0f3e5ce89d2c602cfcc6f2e2008ad75d9fbbff21e2dd08b98d64f0",
  "tool_digest": "sha256:e538e9c6c713fcf6f17c402855641a6520e6c024ca6c9d069b1e2c671b4eca89",
  "body_storage": "digest-locator-and-offset-only",
  "selector_contract": [
    "document-root",
    "h1",
    "h2",
    "h3",
    "h4",
    "h5",
    "h6",
    "dfn",
    "section",
    "article",
    "main",
    "nav",
    "aside",
    "table",
    "figure"
  ],
  "summary": {
    "source_entries": 84,
    "unique_documents": 73,
    "matched_documents": 70,
    "stale_documents": 3,
    "failed_documents": 0,
    "selector_exhaustive_documents": 70,
    "anchors": 15963,
    "anchors_by_kind": {
      "data-table": 986,
      "definition": 7988,
      "document-root": 70,
      "figure": 214,
      "heading": 4099,
      "landmark": 1412,
      "section": 1194
    },
    "classified_anchors": 0,
    "unclassified_anchors": 15963,
    "human_reviewed_anchors": 0,
    "core_v2_eligible_artifacts": 0,
    "authority_semantics_exhaustive": false
  },
  "documents": [
    {
      "id": "document-dom-spec-whatwg-org-a526a274cc5f",
      "path": "authority/body-inventory-draft/document-dom-spec-whatwg-org-a526a274cc5f.json",
      "digest": "sha256:392a27febbb8c31d4e4008491c68446a3ffb5bd0e73019df4b7d16771b81ecba",
      "fetch_status": "matched",
      "source_entries": 1,
      "anchors": 1147,
      "anchors_by_kind": {
        "data-table": 2,
        "definition": 1049,
        "document-root": 1,
        "heading": 93,
        "landmark": 2
      }
    },
    {
      "id": "document-drafts-csswg-org-d17457cf28e7",
      "path": "authority/body-inventory-draft/document-drafts-csswg-org-d17457cf28e7.json",
      "digest": "sha256:2a1259b5f0bb2f209898f2b658d145019126230b881f46713d57b49257218cc0",
      "fetch_status": "matched",
      "source_entries": 2,
      "anchors": 314,
      "anchors_by_kind": {
        "data-table": 4,
        "definition": 250,
        "document-root": 1,
        "heading": 57,
        "landmark": 2
      }
    },
    {
      "id": "document-drafts-csswg-org-d42e1ba5d926",
      "path": "authority/body-inventory-draft/document-drafts-csswg-org-d42e1ba5d926.json",
      "digest": "sha256:7d4954e44c8a4361529412338515daff17e09fd95617f42dc5739a68a64b42c9",
      "fetch_status": "matched",
      "source_entries": 1,
      "anchors": 303,
      "anchors_by_kind": {
        "data-table": 12,
        "definition": 227,
        "document-root": 1,
        "figure": 2,
        "heading": 59,
        "landmark": 2
      }
    },
    {
      "id": "document-github-com-7bbe62dd538a",
      "path": "authority/body-inventory-draft/document-github-com-7bbe62dd538a.json",
      "digest": "sha256:e1f435cc4765cbc91d0b9a0c831a9cb2175732449986514339af6dc1bd6df7be",
      "fetch_status": "stale",
      "source_entries": 1,
      "anchors": 0,
      "anchors_by_kind": {}
    },
    {
      "id": "document-html-spec-whatwg-org-2c571910c725",
      "path": "authority/body-inventory-draft/document-html-spec-whatwg-org-2c571910c725.json",
      "digest": "sha256:9184f879fc21cee6564d8aaba6da552a5c8a219ead0d0d92229810acbc99cd84",
      "fetch_status": "matched",
      "source_entries": 1,
      "anchors": 5,
      "anchors_by_kind": {
        "document-root": 1,
        "heading": 3,
        "landmark": 1
      }
    },
    {
      "id": "document-html-spec-whatwg-org-41179b4efaa2",
      "path": "authority/body-inventory-draft/document-html-spec-whatwg-org-41179b4efaa2.json",
      "digest": "sha256:1a71dcceb6dd5ad7d577249d9f5917144c5c10fdb74a1d6f6840d4430a3b110b",
      "fetch_status": "matched",
      "source_entries": 1,
      "anchors": 478,
      "anchors_by_kind": {
        "data-table": 6,
        "definition": 401,
        "document-root": 1,
        "heading": 68,
        "landmark": 2
      }
    },
    {
      "id": "document-html-spec-whatwg-org-4c87018a6bf7",
      "path": "authority/body-inventory-draft/document-html-spec-whatwg-org-4c87018a6bf7.json",
      "digest": "sha256:b78f370c9fc96f124d9f15eef4e97ef6a105beb251fa13ef9a95ec96325e2f18",
      "fetch_status": "matched",
      "source_entries": 1,
      "anchors": 129,
      "anchors_by_kind": {
        "data-table": 24,
        "definition": 83,
        "document-root": 1,
        "heading": 19,
        "landmark": 2
      }
    },
    {
      "id": "document-html-spec-whatwg-org-53cc3bb15feb",
      "path": "authority/body-inventory-draft/document-html-spec-whatwg-org-53cc3bb15feb.json",
      "digest": "sha256:1b9aea731fb07777e631a19736415763e7deb7e2ba798d10dfe7f124abf66818",
      "fetch_status": "matched",
      "source_entries": 1,
      "anchors": 69,
      "anchors_by_kind": {
        "definition": 61,
        "document-root": 1,
        "heading": 5,
        "landmark": 2
      }
    },
    {
      "id": "document-html-spec-whatwg-org-5533d26f45ea",
      "path": "authority/body-inventory-draft/document-html-spec-whatwg-org-5533d26f45ea.json",
      "digest": "sha256:12855f31ec512fb004419dc5e16283c0c856bb574c40e609e048f4fd453a69f6",
      "fetch_status": "matched",
      "source_entries": 1,
      "anchors": 385,
      "anchors_by_kind": {
        "data-table": 14,
        "definition": 335,
        "document-root": 1,
        "heading": 33,
        "landmark": 2
      }
    },
    {
      "id": "document-html-spec-whatwg-org-7c1e512c2df9",
      "path": "authority/body-inventory-draft/document-html-spec-whatwg-org-7c1e512c2df9.json",
      "digest": "sha256:6ecb7abee9ac098fdfac88d93f246e192586f74cb68d730ba75f34933acf6569",
      "fetch_status": "matched",
      "source_entries": 1,
      "anchors": 60,
      "anchors_by_kind": {
        "definition": 52,
        "document-root": 1,
        "heading": 5,
        "landmark": 2
      }
    },
    {
      "id": "document-html-spec-whatwg-org-8ece377b96f5",
      "path": "authority/body-inventory-draft/document-html-spec-whatwg-org-8ece377b96f5.json",
      "digest": "sha256:09f0314a0aef40ce37700e0ce294640843c1a6281956a0e30244a7a8acda2e31",
      "fetch_status": "matched",
      "source_entries": 3,
      "anchors": 371,
      "anchors_by_kind": {
        "data-table": 9,
        "definition": 321,
        "document-root": 1,
        "figure": 2,
        "heading": 36,
        "landmark": 2
      }
    },
    {
      "id": "document-html-spec-whatwg-org-b77d59af7b57",
      "path": "authority/body-inventory-draft/document-html-spec-whatwg-org-b77d59af7b57.json",
      "digest": "sha256:ceec7df4a13b57879a9b39740b8a3621d78d139e59d8615de645bf7c1902b4e1",
      "fetch_status": "matched",
      "source_entries": 1,
      "anchors": 122,
      "anchors_by_kind": {
        "data-table": 3,
        "definition": 82,
        "document-root": 1,
        "heading": 34,
        "landmark": 2
      }
    },
    {
      "id": "document-html-spec-whatwg-org-c3c0c235d35d",
      "path": "authority/body-inventory-draft/document-html-spec-whatwg-org-c3c0c235d35d.json",
      "digest": "sha256:6f43388d082b35b1ebc88e0f9f6cd6c075939a7ce37818e5097828c1e7c0c00b",
      "fetch_status": "matched",
      "source_entries": 1,
      "anchors": 220,
      "anchors_by_kind": {
        "data-table": 10,
        "definition": 181,
        "document-root": 1,
        "heading": 26,
        "landmark": 2
      }
    },
    {
      "id": "document-html-spec-whatwg-org-d91cc8f86a31",
      "path": "authority/body-inventory-draft/document-html-spec-whatwg-org-d91cc8f86a31.json",
      "digest": "sha256:26a381cf65d9370605a620dc98a20b2eccc8d73773eafc5e5b70be3007756b42",
      "fetch_status": "matched",
      "source_entries": 1,
      "anchors": 85,
      "anchors_by_kind": {
        "data-table": 1,
        "definition": 67,
        "document-root": 1,
        "heading": 14,
        "landmark": 2
      }
    },
    {
      "id": "document-html-spec-whatwg-org-de123d69b6fd",
      "path": "authority/body-inventory-draft/document-html-spec-whatwg-org-de123d69b6fd.json",
      "digest": "sha256:0afdd67327e3c266873be49dea1f49397eb0cbca10161fc33cd032802b5ca446",
      "fetch_status": "matched",
      "source_entries": 1,
      "anchors": 100,
      "anchors_by_kind": {
        "data-table": 6,
        "definition": 79,
        "document-root": 1,
        "heading": 12,
        "landmark": 2
      }
    },
    {
      "id": "document-html-spec-whatwg-org-e510f30c84c8",
      "path": "authority/body-inventory-draft/document-html-spec-whatwg-org-e510f30c84c8.json",
      "digest": "sha256:b7dd3285cb6e58632218630504fc49a7a0a20e0c599405e77b6369bd9894bbce",
      "fetch_status": "matched",
      "source_entries": 1,
      "anchors": 197,
      "anchors_by_kind": {
        "data-table": 3,
        "definition": 153,
        "document-root": 1,
        "heading": 38,
        "landmark": 2
      }
    },
    {
      "id": "document-html-spec-whatwg-org-ea82f49406d2",
      "path": "authority/body-inventory-draft/document-html-spec-whatwg-org-ea82f49406d2.json",
      "digest": "sha256:2d0d8f8c03e1061bfa9252fa83ac7c3d282cdfe8b9edba8e02d9e9e94a042d51",
      "fetch_status": "matched",
      "source_entries": 1,
      "anchors": 64,
      "anchors_by_kind": {
        "data-table": 2,
        "definition": 55,
        "document-root": 1,
        "heading": 4,
        "landmark": 2
      }
    },
    {
      "id": "document-registry-khronos-org-9e94787993b9",
      "path": "authority/body-inventory-draft/document-registry-khronos-org-9e94787993b9.json",
      "digest": "sha256:8af6b4852d4d7c4bb53929b960ac41cb727f240dbba412fd1fcebe579b831a92",
      "fetch_status": "stale",
      "source_entries": 1,
      "anchors": 0,
      "anchors_by_kind": {}
    },
    {
      "id": "document-registry-khronos-org-babcf01a328f",